{
  "schema": "vvdex.service-graph/v1",
  "serviceId": "mcp-integration",
  "name": "MCP Integration",
  "category": "Engineering",
  "family": "engineering_reliability",
  "riskClass": "high",
  "serviceVersion": "0.1.0",
  "graphVersion": "a4803cae1ac5-g2",
  "definitionHash": "a4803cae1ac56fa29acde37a3cfa6efecf0e4de66b95c267d49cd9ce7bac9f91",
  "startNodeId": "step_2",
  "nodeCount": 12,
  "edgeCount": 11,
  "humanGateCount": 1,
  "nodes": [
    {
      "id": "step_2",
      "label": "The build",
      "type": "intake",
      "index": 0,
      "concurrencyGroup": null,
      "sideEffect": "none"
    },
    {
      "id": "step_3",
      "label": "Conformance",
      "type": "deterministic",
      "index": 1,
      "concurrencyGroup": null,
      "sideEffect": "none"
    },
    {
      "id": "step_4",
      "label": "Safety probes",
      "type": "deterministic",
      "index": 2,
      "concurrencyGroup": null,
      "sideEffect": "none"
    },
    {
      "id": "step_5",
      "label": "The independent check",
      "type": "deterministic",
      "index": 3,
      "concurrencyGroup": null,
      "sideEffect": "none"
    },
    {
      "id": "independent_verifier",
      "label": "Independent verification",
      "type": "independent_verifier",
      "index": 4,
      "concurrencyGroup": null,
      "sideEffect": "none"
    },
    {
      "id": "policy_decision",
      "label": "Policy decision",
      "type": "policy_decision",
      "index": 5,
      "concurrencyGroup": null,
      "sideEffect": "none"
    },
    {
      "id": "clean_result",
      "label": "Prepare clean result",
      "type": "side_effect_preparation",
      "index": 6,
      "concurrencyGroup": null,
      "sideEffect": "prepared"
    },
    {
      "id": "exception_gate",
      "label": "Human exception decision",
      "type": "human_gate",
      "index": 7,
      "concurrencyGroup": null,
      "sideEffect": "none"
    },
    {
      "id": "approved_result",
      "label": "Prepare approved exception",
      "type": "side_effect_preparation",
      "index": 8,
      "concurrencyGroup": null,
      "sideEffect": "authorized"
    },
    {
      "id": "clean_receipt",
      "label": "Clean evidence receipt",
      "type": "terminal",
      "index": 9,
      "concurrencyGroup": null,
      "sideEffect": "none"
    },
    {
      "id": "approved_receipt",
      "label": "Approved evidence receipt",
      "type": "terminal",
      "index": 10,
      "concurrencyGroup": null,
      "sideEffect": "none"
    },
    {
      "id": "rejected_receipt",
      "label": "Rejected evidence receipt",
      "type": "terminal",
      "index": 11,
      "concurrencyGroup": null,
      "sideEffect": "none"
    }
  ],
  "edges": [
    {
      "id": "step_2__clean__step_3",
      "source": "step_2",
      "target": "step_3",
      "branchType": "clean"
    },
    {
      "id": "step_3__clean__step_4",
      "source": "step_3",
      "target": "step_4",
      "branchType": "clean"
    },
    {
      "id": "step_4__clean__step_5",
      "source": "step_4",
      "target": "step_5",
      "branchType": "clean"
    },
    {
      "id": "step_5__clean__independent_verifier",
      "source": "step_5",
      "target": "independent_verifier",
      "branchType": "clean"
    },
    {
      "id": "independent_verifier__clean__policy_decision",
      "source": "independent_verifier",
      "target": "policy_decision",
      "branchType": "clean"
    },
    {
      "id": "policy_decision__clean__clean_result",
      "source": "policy_decision",
      "target": "clean_result",
      "branchType": "clean"
    },
    {
      "id": "clean_result__clean__clean_receipt",
      "source": "clean_result",
      "target": "clean_receipt",
      "branchType": "clean"
    },
    {
      "id": "policy_decision__exception__exception_gate",
      "source": "policy_decision",
      "target": "exception_gate",
      "branchType": "exception"
    },
    {
      "id": "exception_gate__approval__approved_result",
      "source": "exception_gate",
      "target": "approved_result",
      "branchType": "approval"
    },
    {
      "id": "approved_result__clean__approved_receipt",
      "source": "approved_result",
      "target": "approved_receipt",
      "branchType": "clean"
    },
    {
      "id": "exception_gate__rejection__rejected_receipt",
      "source": "exception_gate",
      "target": "rejected_receipt",
      "branchType": "rejection"
    }
  ],
  "publicBoundary": {
    "fixtureOnly": true,
    "externalWrites": 0,
    "unresolvedImplementationDecisions": 3,
    "memoryPromotion": "human_review_required"
  }
}
